{
  "id": "h-bench",
  "source_title": "Näthan Cabrol — profil optimisé",
  "created_at": "2026-08-30T23:34:07.310855+00:00",
  "version": "0.1.0",
  "domains": {
    "physical": {
      "domain": "physical",
      "title": "Physique",
      "describe": "Caractéristiques du corps — fonctions corporelles (ICF b*), sensori-motricité, énergie, santé.",
      "estimates": [
        {
          "construct_id": "phys_strength_endurance",
          "construct_label": "Force & endurance physique",
          "domain": "physical",
          "value": 0.62,
          "scale": "unit_interval",
          "estimate_status": "estimated",
          "strength_label": "Forte",
          "epistemic_level": 3,
          "uncertainty": {
            "kind": "composite",
            "total": 0.478,
            "measurement_component": 0.37,
            "evidence_component": 0.1,
            "inference_component": 0.08
          },
          "evidence_ids": [
            "obs-d3e6d9b8e08e",
            "obs-5ffa968356ed",
            "obs-1377a0efb99c"
          ],
          "alternatives": [],
          "rationale": "Force & endurance physique : 3 observation(s) fusionnée(s) sur 3 ; incertitude totale 0.48.",
          "window": null,
          "context": {}
        },
        {
          "construct_id": "phys_health_security",
          "construct_label": "État de santé & sécurité",
          "domain": "physical",
          "value": 0.59,
          "scale": "unit_interval",
          "estimate_status": "estimated",
          "strength_label": "Modérée",
          "epistemic_level": 3,
          "uncertainty": {
            "kind": "composite",
            "total": 0.478,
            "measurement_component": 0.37,
            "evidence_component": 0.1,
            "inference_component": 0.08
          },
          "evidence_ids": [
            "obs-e5c481efbb7e",
            "obs-b4d1754834eb"
          ],
          "alternatives": [],
          "rationale": "État de santé & sécurité : 2 observation(s) fusionnée(s) sur 2 ; incertitude totale 0.48.",
          "window": null,
          "context": {}
        }
      ],
      "refusals": [],
      "observations": [
        {
          "id": "obs-e5c481efbb7e",
          "construct_ids": [
            "phys_health_security"
          ],
          "content": "condition physique [intensité=0.68]",
          "channel": "physiological",
          "alignment": "close",
          "raw_value": null,
          "normalized_value": 0.68,
          "confidence": 0.75,
          "missingness": "",
          "quality_flag": "ok",
          "window": null,
          "context": {},
          "provenance": {
            "agent": "language-decoder",
            "agent_kind": "software",
            "activity_type": "DecodeActivity",
            "source_document": "narrative",
            "source_location": "narrative:252:270",
            "source_page": null,
            "software_version": "0.1.0",
            "timestamp": "2026-08-30T23:34:07.307219+00:00"
          },
          "epistemic_level": 1,
          "source_span": "condition physique"
        },
        {
          "id": "obs-d3e6d9b8e08e",
          "construct_ids": [
            "phys_strength_endurance"
          ],
          "content": "endurance [intensité=0.68]",
          "channel": "physiological",
          "alignment": "close",
          "raw_value": null,
          "normalized_value": 0.68,
          "confidence": 0.75,
          "missingness": "",
          "quality_flag": "ok",
          "window": null,
          "context": {},
          "provenance": {
            "agent": "language-decoder",
            "agent_kind": "software",
            "activity_type": "DecodeActivity",
            "source_document": "narrative",
            "source_location": "narrative:285:294",
            "source_page": null,
            "software_version": "0.1.0",
            "timestamp": "2026-08-30T23:34:07.308564+00:00"
          },
          "epistemic_level": 1,
          "source_span": "endurance"
        },
        {
          "id": "obs-5ffa968356ed",
          "construct_ids": [
            "phys_strength_endurance"
          ],
          "content": "physique [intensité=0.68]",
          "channel": "physiological",
          "alignment": "close",
          "raw_value": null,
          "normalized_value": 0.68,
          "confidence": 0.75,
          "missingness": "",
          "quality_flag": "ok",
          "window": null,
          "context": {},
          "provenance": {
            "agent": "language-decoder",
            "agent_kind": "software",
            "activity_type": "DecodeActivity",
            "source_document": "narrative",
            "source_location": "narrative:262:270",
            "source_page": null,
            "software_version": "0.1.0",
            "timestamp": "2026-08-30T23:34:07.308900+00:00"
          },
          "epistemic_level": 1,
          "source_span": "physique"
        },
        {
          "id": "obs-1377a0efb99c",
          "construct_ids": [
            "phys_strength_endurance"
          ],
          "content": "Cordiste",
          "channel": "physiological",
          "alignment": "close",
          "raw_value": null,
          "normalized_value": 0.5,
          "confidence": 0.75,
          "missingness": "",
          "quality_flag": "ok",
          "window": null,
          "context": {},
          "provenance": {
            "agent": "language-decoder",
            "agent_kind": "software",
            "activity_type": "DecodeActivity",
            "source_document": "narrative",
            "source_location": "narrative:204:212",
            "source_page": null,
            "software_version": "0.1.0",
            "timestamp": "2026-08-30T23:34:07.308954+00:00"
          },
          "epistemic_level": 1,
          "source_span": "Cordiste"
        },
        {
          "id": "obs-b4d1754834eb",
          "construct_ids": [
            "phys_health_security"
          ],
          "content": "sécurité",
          "channel": "physiological",
          "alignment": "close",
          "raw_value": null,
          "normalized_value": 0.5,
          "confidence": 0.75,
          "missingness": "",
          "quality_flag": "ok",
          "window": null,
          "context": {},
          "provenance": {
            "agent": "language-decoder",
            "agent_kind": "software",
            "activity_type": "DecodeActivity",
            "source_document": "narrative",
            "source_location": "narrative:329:337",
            "source_page": null,
            "software_version": "0.1.0",
            "timestamp": "2026-08-30T23:34:07.309007+00:00"
          },
          "epistemic_level": 1,
          "source_span": "sécurité"
        }
      ]
    },
    "mental": {
      "domain": "mental",
      "title": "Mental",
      "describe": "Processus cognitifs & affectifs — perception, attention, mémoire, langage, contrôle, métacognition, émotion, motivation.",
      "estimates": [
        {
          "construct_id": "mental_reasoning",
          "construct_label": "Raisonnement & résolution de problèmes",
          "domain": "mental",
          "value": 0.8,
          "scale": "unit_interval",
          "estimate_status": "estimated",
          "strength_label": "Forte",
          "epistemic_level": 2,
          "uncertainty": {
            "kind": "composite",
            "total": 0.478,
            "measurement_component": 0.37,
            "evidence_component": 0.1,
            "inference_component": 0.08
          },
          "evidence_ids": [
            "obs-56cd1ca8dfa5",
            "obs-dae72b0e9f80"
          ],
          "alternatives": [],
          "rationale": "Raisonnement & résolution de problèmes : 2 observation(s) fusionnée(s) sur 2 ; incertitude totale 0.48.",
          "window": null,
          "context": {}
        },
        {
          "construct_id": "mental_emotion_regulation",
          "construct_label": "Régulation émotionnelle",
          "domain": "mental",
          "value": 0.38,
          "scale": "unit_interval",
          "estimate_status": "estimated",
          "strength_label": "Faible",
          "epistemic_level": 3,
          "uncertainty": {
            "kind": "composite",
            "total": 0.478,
            "measurement_component": 0.37,
            "evidence_component": 0.1,
            "inference_component": 0.08
          },
          "evidence_ids": [
            "obs-a508e4546312"
          ],
          "alternatives": [],
          "rationale": "Régulation émotionnelle : 1 observation(s) fusionnée(s) sur 1 ; incertitude totale 0.48.",
          "window": null,
          "context": {}
        },
        {
          "construct_id": "mental_social_cognition",
          "construct_label": "Cognition sociale & relationnelle",
          "domain": "mental",
          "value": 0.8,
          "scale": "unit_interval",
          "estimate_status": "estimated",
          "strength_label": "Forte",
          "epistemic_level": 3,
          "uncertainty": {
            "kind": "composite",
            "total": 0.478,
            "measurement_component": 0.37,
            "evidence_component": 0.1,
            "inference_component": 0.08
          },
          "evidence_ids": [
            "obs-258749b1885d"
          ],
          "alternatives": [],
          "rationale": "Cognition sociale & relationnelle : 1 observation(s) fusionnée(s) sur 1 ; incertitude totale 0.48.",
          "window": null,
          "context": {}
        },
        {
          "construct_id": "mental_spatial_numeric",
          "construct_label": "Cognition spatiale & numérique",
          "domain": "mental",
          "value": 0.68,
          "scale": "unit_interval",
          "estimate_status": "estimated",
          "strength_label": "Forte",
          "epistemic_level": 3,
          "uncertainty": {
            "kind": "composite",
            "total": 0.478,